[
    {
        "fields": [
            {
                "fieldType": "idPopulator",
                "localisableProperties": [
                    "errorMessage",
                    "tooltip",
                    "innerLabel",
                    "helpText",
                    "label",
                    "message"
                ]
            },
            {
                "fieldType": "button",
                "localisableProperties": [
                    "errorMessage",
                    "tooltip",
                    "innerLabel",
                    "helpText",
                    "label",
                    "message"
                ]
            },
            {
                "fieldType": "toggle",
                "localisableProperties": [
                    "errorMessage",
                    "tooltip",
                    "innerLabel",
                    "helpText",
                    "label",
                    "message"
                ]
            },
            {
                "fieldType": "filter",
                "localisableProperties": [
                    "errorMessage",
                    "tooltip",
                    "innerLabel",
                    "helpText",
                    "label",
                    "message"
                ]
            },
            {
                "fieldType": "searchBar",
                "localisableProperties": [
                    "errorMessage",
                    "tooltip",
                    "innerLabel",
                    "helpText",
                    "label",
                    "message"
                ]
            },
            {
                "fieldType": "searchByProximity",
                "localisableProperties": [
                    "errorMessage",
                    "tooltip",
                    "innerLabel",
                    "helpText",
                    "label",
                    "message"
                ]
            },
            {
                "fieldType": "BeneficiaryRegistrationButton",
                "localisableProperties": [
                    "errorMessage",
                    "tooltip",
                    "innerLabel",
                    "helpText",
                    "label",
                    "message"
                ]
            },
            {
                "fieldType": "qrscanner",
                "localisableProperties": [
                    "errorMessage",
                    "tooltip",
                    "innerLabel",
                    "helpText",
                    "label",
                    "message"
                ]
            },
            {
                "fieldType": "text",
                "localisableProperties": [
                    "errorMessage",
                    "tooltip",
                    "innerLabel",
                    "helpText",
                    "label",
                    "message"
                ]
            },
            {
                "fieldType": "textInput",
                "localisableProperties": [
                    "errorMessage",
                    "tooltip",
                    "innerLabel",
                    "helpText",
                    "label",
                    "message"
                ]
            },
            {
                "fieldType": "dropdown",
                "localisableProperties": [
                    "errorMessage",
                    "tooltip",
                    "innerLabel",
                    "helpText",
                    "label",
                    "dropdownOptions",
                    "dropDownOptions",
                    "message"
                ]
            },
            {
                "fieldType": "number",
                "localisableProperties": [
                    "errorMessage",
                    "tooltip",
                    "innerLabel",
                    "helpText",
                    "label",
                    "message"
                ]
            },
            {
                "fieldType": "numeric",
                "localisableProperties": [
                    "errorMessage",
                    "tooltip",
                    "innerLabel",
                    "helpText",
                    "label",
                    "message"
                ]
            },
            {
                "fieldType": "checkbox",
                "localisableProperties": [
                    "errorMessage",
                    "tooltip",
                    "innerLabel",
                    "helpText",
                    "label",
                    "message"
                ]
            },
            {
                "fieldType": "numeric",
                "localisableProperties": [
                    "errorMessage",
                    "tooltip",
                    "innerLabel",
                    "helpText",
                    "label",
                    "message"
                ]
            },
            {
                "fieldType": "scanner",
                "localisableProperties": [
                    "errorMessage",
                    "tooltip",
                    "innerLabel",
                    "helpText",
                    "label",
                    "message"
                ]
            },
            {
                "fieldType": "date",
                "localisableProperties": [
                    "errorMessage",
                    "tooltip",
                    "innerLabel",
                    "helpText",
                    "label",
                    "message"
                ]
            },
            {
                "fieldType": "dob",
                "localisableProperties": [
                    "errorMessage",
                    "tooltip",
                    "innerLabel",
                    "helpText",
                    "label",
                    "message"
                ]
            },
            {
                "fieldType": "administrativeArea",
                "localisableProperties": [
                    "errorMessage",
                    "tooltip",
                    "innerLabel",
                    "helpText",
                    "label",
                    "message"
                ]
            },
            {
                "fieldType": "latLng",
                "localisableProperties": [
                    "errorMessage",
                    "tooltip",
                    "innerLabel",
                    "helpText",
                    "label",
                    "message"
                ]
            },
            {
                "fieldType": "textArea",
                "localisableProperties": [
                    "errorMessage",
                    "tooltip",
                    "innerLabel",
                    "helpText",
                    "label",
                    "message"
                ]
            },
            {
                "fieldType": "mobileNumber",
                "localisableProperties": [
                    "errorMessage",
                    "tooltip",
                    "innerLabel",
                    "helpText",
                    "label",
                    "message"
                ]
            },
            {
                "fieldType": "radio",
                "localisableProperties": [
                    "errorMessage",
                    "tooltip",
                    "innerLabel",
                    "helpText",
                    "label",
                    "message"
                ]
            },
            {
                "fieldType": "select",
                "localisableProperties": [
                    "errorMessage",
                    "tooltip",
                    "innerLabel",
                    "helpText",
                    "label",
                    "message"
                ]
            },
            {
                "fieldType": "editHousehold",
                "localisableProperties": [
                    "errorMessage",
                    "tooltip",
                    "innerLabel",
                    "helpText",
                    "label",
                    "message"
                ]
            },
            {
                "fieldType": "editIndividual",
                "localisableProperties": [
                    "errorMessage",
                    "tooltip",
                    "innerLabel",
                    "helpText",
                    "label",
                    "message"
                ]
            },
            {
                "fieldType": "Table",
                "localisableProperties": [
                    "errorMessage",
                    "tooltip",
                    "innerLabel",
                    "helpText",
                    "label",
                    "message"
                ]
            },
            {
                "fieldType": "DetailsCard",
                "localisableProperties": [
                    "errorMessage",
                    "tooltip",
                    "innerLabel",
                    "helpText",
                    "label",
                    "message"
                ]
            },
            {
                "fieldType": "addMember",
                "localisableProperties": [
                    "errorMessage",
                    "tooltip",
                    "innerLabel",
                    "helpText",
                    "label",
                    "message"
                ]
            },
            {
                "fieldType": "IndividualDeliveryPrimaryButton",
                "localisableProperties": [
                    "errorMessage",
                    "tooltip",
                    "innerLabel",
                    "helpText",
                    "label",
                    "message"
                ]
            },
            {
                "fieldType": "IndividualDeliverySecondaryButton",
                "localisableProperties": [